[
  {
    "id": "ex.p.marked-for-justice",
    "name": "MARKED FOR JUSTICE",
    "team": "exaction-squad",
    "type": "strategy",
    "cost": 0,
    "window": "strategy.gambit",
    "effect": {
      "code": "exMarkedForJustice",
      "scope": {
        "side": "friendly",
        "keyword": "EXACTION SQUAD"
      }
    },
    "text": "Once per turning point, for no CP: pick any enemy as your mark. Friendly Exaction Squad operatives shooting, fighting or retaliating against it have Punishing. Whenever the mark falls you may pick a new one for the rest of the turning point.",
    "source": "team-exaction-squad.pdf (Jun '26); docs/spec/13-teams.md section 24.6"
  },
  {
    "id": "ex.p.attack-pattern",
    "name": "ATTACK PATTERN",
    "team": "exaction-squad",
    "type": "strategy",
    "cost": 0,
    "window": "strategy.gambit",
    "effect": {
      "code": "exAttackPattern",
      "scope": {
        "side": "friendly",
        "keyword": "EXACTION SQUAD"
      }
    },
    "text": "Turning point 1 only, for no CP: the Leashmaster picks two different attack patterns for a friendly Cyber-mastiff, kept for the battle.",
    "source": "team-exaction-squad.pdf (Jun '26); docs/spec/13-teams.md section 24.6"
  },
  {
    "id": "ex.p.first-in-the-field",
    "name": "FIRST IN THE FIELD",
    "team": "exaction-squad",
    "type": "strategy",
    "cost": 0,
    "window": "strategy.gambit",
    "effect": {
      "code": "exFirstInTheField",
      "scope": {
        "side": "friendly",
        "keyword": "EXACTION SQUAD"
      }
    },
    "text": "Turning point 1 only, for no CP: a Revelatum wholly within your drop zone takes a free Reposition.",
    "source": "team-exaction-squad.pdf (Jun '26); docs/spec/13-teams.md section 24.6"
  },
  {
    "id": "ex.p.guilt-reveals-itself",
    "name": "GUILT REVEALS ITSELF",
    "team": "exaction-squad",
    "type": "strategy",
    "cost": 1,
    "window": "strategy.gambit",
    "effect": {
      "code": "exFlagPloy",
      "params": {
        "flag": "guilt"
      },
      "scope": {
        "side": "friendly",
        "keyword": "EXACTION SQUAD"
      }
    },
    "text": "This turning point, when a friendly Exaction Squad operative picks a valid target, an enemy within 4 inches of it cannot count as in cover for that choice (2 inches normally). It keeps its cover save unless within 2 inches.",
    "source": "team-exaction-squad.pdf (Jun '26); docs/spec/13-teams.md section 24.6"
  },
  {
    "id": "ex.p.inviolate-jurisdiction",
    "name": "INVIOLATE JURISDICTION",
    "team": "exaction-squad",
    "type": "strategy",
    "cost": 1,
    "window": "strategy.gambit",
    "effect": {
      "code": "exFlagPloy",
      "params": {
        "flag": "inviolate"
      },
      "scope": {
        "side": "friendly",
        "keyword": "EXACTION SQUAD"
      }
    },
    "text": "This turning point, when an operative shoots a friendly Exaction Squad operative within 2 inches of an objective marker or of an enemy, you may re-roll one defence die.",
    "source": "team-exaction-squad.pdf (Jun '26); docs/spec/13-teams.md section 24.6"
  },
  {
    "id": "ex.p.dispense-justice",
    "name": "DISPENSE JUSTICE",
    "team": "exaction-squad",
    "type": "strategy",
    "cost": 1,
    "window": "strategy.gambit",
    "effect": {
      "code": "exFlagPloy",
      "params": {
        "flag": "dispense"
      },
      "scope": {
        "side": "friendly",
        "keyword": "EXACTION SQUAD"
      }
    },
    "text": "This turning point, when a friendly Exaction Squad operative fights or retaliates, its melee weapons have Ceaseless if it has not moved more than its Move stat in the activation, or if it is counteracting.",
    "source": "team-exaction-squad.pdf (Jun '26); docs/spec/13-teams.md section 24.6"
  },
  {
    "id": "ex.p.terminal-decree",
    "name": "TERMINAL DECREE",
    "team": "exaction-squad",
    "type": "strategy",
    "cost": 1,
    "window": "strategy.gambit",
    "effect": {
      "code": "exFlagPloy",
      "params": {
        "flag": "decree"
      },
      "scope": {
        "side": "friendly",
        "keyword": "EXACTION SQUAD"
      }
    },
    "text": "This turning point, when a friendly Exaction Squad operative shoots an enemy within 6 inches, and whenever a friendly Gunner shoots at any range, its ranged weapons have Balanced.",
    "source": "team-exaction-squad.pdf (Jun '26); docs/spec/13-teams.md section 24.6"
  },
  {
    "id": "ex.p.long-arm",
    "name": "LONG ARM OF THE EMPEROR'S LAW",
    "team": "exaction-squad",
    "type": "firefight",
    "cost": 1,
    "window": "firefight.actionDeclared",
    "effect": {
      "code": "exLongArm",
      "scope": {
        "side": "friendly",
        "keyword": "EXACTION SQUAD"
      }
    },
    "text": "When a friendly Exaction Squad operative performs Shoot, a ranged weapon with Range x (not frag or krak grenades) it picks has Range 3 inches longer until the end of the action.",
    "source": "team-exaction-squad.pdf (Jun '26); docs/spec/13-teams.md section 24.6"
  },
  {
    "id": "ex.p.exact-punishment",
    "name": "EXACT PUNISHMENT",
    "team": "exaction-squad",
    "type": "firefight",
    "cost": 1,
    "window": "firefight.actionEnded",
    "effect": {
      "code": "exExactPunishment",
      "scope": {
        "side": "friendly",
        "keyword": "EXACTION SQUAD"
      }
    },
    "text": "After an enemy shoots or fights a friendly Exaction Squad operative within 6 inches of it that survives, that operative takes a free Shoot or Fight against that enemy only.",
    "source": "team-exaction-squad.pdf (Jun '26); docs/spec/13-teams.md section 24.6"
  },
  {
    "id": "ex.p.brutal-backup",
    "name": "BRUTAL BACKUP",
    "team": "exaction-squad",
    "type": "firefight",
    "cost": 1,
    "window": [
      "firefight.activationStart",
      "firefight.actionEnded"
    ],
    "effect": {
      "code": "exBrutalBackup",
      "scope": {
        "side": "friendly",
        "keyword": "EXACTION SQUAD"
      }
    },
    "text": "During a friendly Exaction Squad operative's activation, pick an enemy in its control range: another friendly Exaction Squad operative takes a free Fight against that enemy only.",
    "source": "team-exaction-squad.pdf (Jun '26); docs/spec/13-teams.md section 24.6"
  },
  {
    "id": "ex.p.execution-order",
    "name": "EXECUTION ORDER",
    "team": "exaction-squad",
    "type": "firefight",
    "cost": 1,
    "window": [
      "firefight.opponentActionDeclared",
      "turningPoint.end"
    ],
    "effect": {
      "code": "exExecutionOrder",
      "scope": {
        "side": "friendly",
        "keyword": "EXACTION SQUAD"
      }
    },
    "text": "When an enemy performs a mission action other than Operate Hatch, or at the end of the Firefight phase against an enemy controlling an objective: the next time it is activated, a ready friendly Exaction Squad operative strikes it first.",
    "source": "team-exaction-squad.pdf (Jun '26); docs/spec/13-teams.md section 24.6"
  }
]
