[
  {
    "id": "ph.p.guerrilla-warfare",
    "name": "GUERRILLA WARFARE",
    "team": "phobos-strike-team",
    "type": "strategy",
    "cost": 1,
    "window": "strategy.gambit",
    "effect": {
      "code": "phFlagPloy",
      "params": {
        "flag": "guerrillaWarfare"
      },
      "scope": {
        "side": "friendly",
        "keyword": "PHOBOS STRIKE TEAM"
      }
    },
    "text": "This turning point every friendly Phobos operative gains the unique action GUERRILLA WARFARE (1 AP): change this operative's order. Not in an enemy control range.",
    "source": "team-phobos-strike-team.pdf (Nov '25); docs/spec/13-teams.md T-PH.27"
  },
  {
    "id": "ph.p.and-they-shall-know-no-fear",
    "name": "AND THEY SHALL KNOW NO FEAR",
    "team": "phobos-strike-team",
    "type": "strategy",
    "cost": 1,
    "window": "strategy.gambit",
    "effect": {
      "code": "phFlagPloy",
      "params": {
        "flag": "andTheyShallKnowNoFear"
      },
      "scope": {
        "side": "friendly",
        "keyword": "PHOBOS STRIKE TEAM"
      }
    },
    "text": "This turning point friendly Phobos operatives ignore every injured stat change (Move and weapon Hit).",
    "source": "team-phobos-strike-team.pdf (Nov '25); docs/spec/13-teams.md T-PH.28"
  },
  {
    "id": "ph.p.deadly-shots",
    "name": "DEADLY SHOTS",
    "team": "phobos-strike-team",
    "type": "strategy",
    "cost": 1,
    "window": "strategy.gambit",
    "effect": {
      "code": "phFlagPloy",
      "params": {
        "flag": "deadlyShots"
      },
      "scope": {
        "side": "friendly",
        "keyword": "PHOBOS STRIKE TEAM"
      }
    },
    "text": "This turning point a friendly Phobos operative's ranged weapons have Balanced while it shoots, either in an activation where it has not yet charged, fallen back or repositioned, or at a target that is not in cover and is more than 6 inches away. Checked per target.",
    "source": "team-phobos-strike-team.pdf (Nov '25); docs/spec/13-teams.md T-PH.29"
  },
  {
    "id": "ph.p.lethal-assaults",
    "name": "LETHAL ASSAULTS",
    "team": "phobos-strike-team",
    "type": "strategy",
    "cost": 1,
    "window": "strategy.gambit",
    "effect": {
      "code": "phFlagPloy",
      "params": {
        "flag": "lethalAssaults"
      },
      "scope": {
        "side": "friendly",
        "keyword": "PHOBOS STRIKE TEAM"
      }
    },
    "text": "This turning point, whenever a friendly Phobos operative fights (not retaliates), its melee weapons have Balanced, and Lethal 5+ as well if it charged earlier in the same activation.",
    "source": "team-phobos-strike-team.pdf (Nov '25); docs/spec/13-teams.md T-PH.30"
  },
  {
    "id": "ph.p.patient-ambush",
    "name": "PATIENT AMBUSH",
    "team": "phobos-strike-team",
    "type": "firefight",
    "cost": 1,
    "window": "firefight.beforeActivation",
    "effect": {
      "code": "phPatientAmbush"
    },
    "text": "When it is your turn to activate a friendly operative, skip that activation: play passes to your opponent.",
    "source": "team-phobos-strike-team.pdf (Nov '25); docs/spec/13-teams.md T-PH.31"
  },
  {
    "id": "ph.p.critical-shot",
    "name": "CRITICAL SHOT",
    "team": "phobos-strike-team",
    "type": "firefight",
    "cost": 1,
    "window": "shoot.attackerDefenceRolled",
    "when": {
      "critRetained": true
    },
    "effect": {
      "code": "phCriticalShot",
      "scope": {
        "side": "friendly",
        "keyword": "PHOBOS STRIKE TEAM"
      }
    },
    "text": "When a friendly Phobos operative shoots with a bolt weapon and keeps a critical hit, the first critical hit that deals damage deals D3 extra damage.",
    "source": "team-phobos-strike-team.pdf (Nov '25); docs/spec/13-teams.md T-PH.32"
  },
  {
    "id": "ph.p.transhuman-physiology",
    "name": "TRANSHUMAN PHYSIOLOGY",
    "team": "phobos-strike-team",
    "type": "firefight",
    "cost": 1,
    "window": "shoot.defenceRolled",
    "effect": {
      "retainSuccess": {
        "kind": "crit",
        "count": 1,
        "from": "normal"
      }
    },
    "text": "When any operative shoots a friendly Phobos operative, after the defence roll, keep one of your normal defence successes as a critical success instead.",
    "source": "team-phobos-strike-team.pdf (Nov '25); docs/spec/13-teams.md T-PH.33"
  },
  {
    "id": "ph.p.stealth-assault",
    "name": "STEALTH ASSAULT",
    "team": "phobos-strike-team",
    "type": "firefight",
    "cost": 1,
    "window": "fight.rolled",
    "effect": {
      "code": "phStealthAssault",
      "scope": {
        "side": "friendly",
        "keyword": "PHOBOS STRIKE TEAM"
      }
    },
    "text": "A friendly Phobos operative that had a Conceal order when activated was given Engage, then charged and fought as its first two actions: after it resolves its first attack die you immediately resolve one more of your dice before the opponent resolves.",
    "source": "team-phobos-strike-team.pdf (Nov '25); docs/spec/13-teams.md T-PH.34"
  },
  {
    "id": "ph.p.omni-scrambler",
    "name": "OMNI-SCRAMBLER",
    "team": "phobos-strike-team",
    "type": "strategy",
    "cost": 0,
    "window": "strategy.gambit",
    "effect": {
      "code": "phOmniScrambler",
      "scope": {
        "side": "friendly",
        "keyword": "INFILTRATOR"
      }
    },
    "text": "A strategic gambit (free of CP) while a friendly Infiltrator is in the killzone: pick an enemy a friendly Infiltrator can see, or that is within 6 inches of a friendly Voxbreaker. For the rest of this turning point's Firefight phase that enemy cannot be activated or take any action until your opponent has activated as many operatives as you had Infiltrators in the killzone, or it is their last operative left to activate.",
    "source": "team-phobos-strike-team.pdf (Nov '25); docs/spec/13-teams.md T-PH.23"
  }
]
